{
  "schema_version": "0.1.0",
  "session_id": "harness-stage2-example",
  "run_id": "run-schema-smoke-001",
  "harness_version": "0.1.0",
  "inputs": {
    "task": "examples/evals/harness-self-test/v1.0.0/task.yaml",
    "runner": "examples/agent-runners/stub.yaml"
  },
  "environment_snapshot": {
    "environment": "examples/environments/local.yaml",
    "sandbox": "examples/policies/sandbox-policy.yaml",
    "approval_policy": "examples/policies/approval-policy.yaml",
    "model_profile": "examples/model-profiles/stub.yaml",
    "runner": "examples/agent-runners/stub.yaml"
  },
  "started_at": "2026-05-20T00:00:00Z",
  "completed_at": "2026-05-20T00:00:01Z",
  "duration_ms": 1000,
  "exit_code": 0,
  "determinism_level": "recorded",
  "usage": {
    "billed_model_id": "stub-v1",
    "input_tokens": 0,
    "output_tokens": 0,
    "total_tokens": 0,
    "requests": 0,
    "incurred_cost_usd": 0,
    "source": "stub"
  },
  "actions": [
    {
      "id": "approval-record",
      "type": "approval",
      "timestamp": "2026-05-20T00:00:00Z",
      "summary": "Recorded an approval decision for the fixture run.",
      "approval_decision": {
        "decision": "approve",
        "risk_class": "low",
        "from_state": "pending",
        "to_state": "approved",
        "transport": "cli-interactive",
        "log_ref": ".harness/approvals/modify-log.jsonl"
      },
      "artifacts": []
    },
    {
      "id": "verify-harness-file",
      "type": "verifier",
      "timestamp": "2026-05-20T00:00:00Z",
      "summary": "Checked that the harness example exists.",
      "artifacts": [
        {
          "path": "examples/harness.yaml",
          "media_type": "application/yaml",
          "description": "Harness example."
        }
      ]
    }
  ],
  "logs": [],
  "artifact_links": [
    {
      "path": "examples/run-results/run-result.json",
      "media_type": "application/json",
      "description": "Run result for this trace."
    }
  ]
}
